Feature Identifier	Sequence Feature Name	Sequence Feature Length	Variant Types	Category	Amino Acid Position	Evidence	Comments	
Influenza A_M2_SF11	Influenza A_M2_viral-assembly-and-morhogenesis-site_74(6)	6	106	sequence alteration	74..79	PMID: 16699003,	These residues play a role in play a role in virion morphogenesis and affect viral infectivity	
Influenza A_M2_SF13	Influenza A_M2_CRAC-motif_46(15)	15	474	functional	46..60	PMID: 15221235,	This is the 'cholesterol recognition consensus (CRAC) motif' found downstream of the transmembrane domain in the cytoplasmic tail region and also possess the C50 palmitoylation site. It is involved in M2 cholesterol binding.	
Influenza A_M2_SF15	Influenza A_M2_determinant-of-host-range-specificity_11(5)	5	172	functional	11,14,16,18,20	PMID: 15777646,	At positions 11, 14, 16, 18 and 20, Weybridge possesses Thr, Gly, Glu, Ser and Ser, whereas WSN possesses Ile, Glu, Gly, Arg and Asn, respectively.	
Influenza A_M2_SF16	Influenza A_M2_determinant-of-amantadine-resistance_26(1)	1	12	functional	26	PMID: 15673732,	This residue is one of the critical amino acid occuring within the transmembrane domain of M2 protein. Substitution at this residue results in loss of sensitivity to M2 inhibitor drugs.	
Influenza A_M2_SF17	Influenza A_M2_determinant-of-amantadine-resistance_27(1)	1	15	functional	27	PMID: 15673732,	It is shown that single-amino-acid substitution at this position within the transmembrane domain of M2 produces amantadine resistance in Influenza viruses	
Influenza A_M2_SF18	Influenza A_M2_determinant-of-amantadine-resistance_30(1)	1	13	functional	30	PMID: 15673732,	It is shown that single-amino-acid substitution at this position within the transmembrane domain of M2 produces amantadine resistance in Influenza viruses	
Influenza A_M2_SF19	Influenza A_M2_determinant-of-amantadine-resistance_31(1)	1	14	functional	31	PMID: 15673732,	It is shown that single-amino-acid substitution at this position within the transmembrane domain of M2 produces amantadine resistance in Influenza viruses	
Influenza A_M2_SF20	Influenza A_M2_determinant-of-amantadine-resistance_34(1)	1	9	functional	34	PMID: 15673732,	It is shown that single-amino-acid substitution at this position within the transmembrane domain of M2 produces amantadine resistance in Influenza viruses	
Influenza A_M2_SF103	Influenza A_M2_determinant-of-virulence_50(1)	1	14	functional	50	PMID: 19553312,	The viruses lacking the palmitoylation site at this residue have been shown to cause a modest reduction in virulence in vivo (mouse models) although the effect is not seen tissue culture cells.	
Influenza A_M2_SF104	Influenza A_M2_determinants-of-infectivity_74(6)	6	98	functional	74..79	PMID: 16699003,	The amino acids 74 to 79 of the M2 tail play a role in virion morphogenesis and affect viral infectivity.	
Influenza A_M2_SF108	Influenza A_M2_determinant-of-transmission_16(1)	1	12	sequence alteration	16	PMID: 22132146,	A16G substitution leads to enhanced transmission in humans	
Influenza A_M2_SF109	Influenza A_M2_determinant-of-transmission_55(1)	1	14	sequence alteration	55	PMID: 22132146,	C55F substitution leads to enhanced transmission in humans	
Influenza A_M2_SF110	Influenza A_M2_determinant-of-drug-resistance_31(1)	1	14	sequence alteration	31	PMID: 22132146,	31N confers resistance to Adamantane	
Influenza A_M2_SF111	Influenza A_M2_determinant-of-drug-resistance_26(1)	1	11	sequence alteration	26	PMID: 16456087, PMID: 15673732,	26F confers resistance to Adamantane	
Influenza A_M2_SF112	Influenza A_M2_determinant-of-drug-resistance_27(1)	1	14	sequence alteration	27	PMID: 16456087, PMID: 15673732,	27A confers resistance to Adamantane	
Influenza A_M2_SF113	Influenza A_M2_determinant-of-drug-resistance_30(1)	1	14	sequence alteration	30	PMID: 16456087, PMID: 15673732,	30T confers resistance to Adamantane	
Influenza A_M2_SF114	Influenza A_M2_determinant-of-drug-resistance_34(1)	1	9	sequence alteration	34	PMID: 16456087, PMID: 15673732,	34E confers resistance to Adamantane	
Influenza A_M2_SF118	Influenza A_M2_antiviral-activity_26(1)	1	10	functional	26	PMID:20834097, PMID:15673732 ,	Introduction of Leu26Phe substitution in the WSN/1933 backbone conferred decreased sensitivity to amantadine as indicated by plaque reduction assay in MDBK cells and reduced plaque sizes.	
Influenza A_M2_SF119	Influenza A_M2_antiviral-activity_34(1)	1	8	functional	34	PMID:15673732,	Introduction of Gly34Glu substitution in the WSN/1933 backbone conferred decreased sensitivity to amantadine as indicated by plaque reduction assay.	
Influenza A_M2_SF120	Influenza A_M2_antiviral-activity_27(1)	1	13	functional	27	PMID:20834097, PMID:15673732, PMID:16703504, PMID:16081121 ,	Introduction of Val27Ala substitution in the A/Chicken/Hong Kong/YU250/03 backbone conferred decreased sensitivity to amantadine.	
Influenza A_M2_SF121	Influenza A_M2_Antiviral-activity_31(1)	1	13	functional	31	PMID: 20834097; 16703504; 2723453; 17897729; 17431677;  15659762; 17494553; 16081121 ,	A/Chicken/Hebei/108/2002 isolate with Ser31Asn substitution conferred decreased sensitivity to amantadine and rimantadine in MDCK cells using plaque assay.  	
Influenza A_M2_SF122	Influenza A_M2_Antiviral-activity_31(1)	1	13	functional	31	PMID: 20834097; 16703504; 2723453; 17897729; 17431677;  15659762; 17494553; 16081121 ,	A/Chicken/Hebei/108/2002 isolate with Ser31Asn substitution conferred decreased sensitivity to amantadine and rimantadine in MDCK cells using plaque assay.  	
Influenza A_M2_AVD_SF1	Influenza A_M2_antiviral-binding-site_2RLF_40(5)	5	34	functional	40..41,43..45	PMID: 18235503,	Rimantadine Binding Site	
Influenza A_M2_AVD_SF2	Influenza A_M2_antiviral-binding-site_2LJC_30(2)	2	24	functional	30..31	PMID: 22078564,	Rimantadine Binding Site	
